User Id,User Name,Comment Id,Comment Text,Profile URL,Avatar URL,Publish Date
67559311008,diniarindie45,18272824807212776,"Semoga diperlancar dan dipermudah oleh Allah pak haji, bismillah menang satu putaran tuk pak haji yg selalu dihati🫰",https://www.instagram.com/diniarindie45,https://instagram.fcgk22-1.fna.fbcdn.net/v/t51.2885-19/450540570_1451768278805655_8473522459310283448_n.jpg,"8/6/2024, 9:51:25 AM"
67403799825,widyanisaa2,18104526940420588,"Saya percaya paak mad romli merupakan pemimpin yang tepat untuk tangerang, dengan visi misi yang jelad dan dedikasi yang besar. Saya percaya pak mad romli bisa membawa perubahan positif untuk tangerang. Maju terus pak mad romli saya dukung bapak💛",https://www.instagram.com/widyanisaa2,https://instagram.fcgk22-1.fna.fbcdn.net/v/t51.2885-19/450896043_858969762954513_3873829424876633402_n.jpg,"8/6/2024, 9:58:14 AM"
67587739017,wulandarisrrr,18047745178860686,"InshaAllah diperlancar pak sampai waktu kemenangan tiba, saya dan keluarga siap dukung pak haji sampai jadi bupati terpilih👍🏻",https://www.instagram.com/wulandarisrrr,https://instagram.fcgk22-2.fna.fbcdn.net/v/t51.2885-19/449839305_856721302973434_2018225328723200248_n.jpg,"8/6/2024, 10:04:15 AM"
67562740845,angrhsaeful,18026262605515872,Calon bupati yang pasti saya coblos di tps. Semangat pak saya dukung bapak. Menyalaaa selalu cabup kebanggaan🔥🔥🔥,https://www.instagram.com/angrhsaeful,https://instagram.fcgk22-2.fna.fbcdn.net/v/t51.2885-19/450320653_1129009068202358_7029955313904981648_n.jpg,"8/6/2024, 10:09:47 AM"
2156352741,tamtam_sulis,18060135970623187,Assalamualaikum pak @h.madromli bantu acara 17an pak di Cikupa dong pak. Bisa ga yah pak,https://www.instagram.com/tamtam_sulis,https://instagram.fcgk22-2.fna.fbcdn.net/v/t51.2885-19/453067496_1034356498353383_7339687692784926178_n.jpg,"8/6/2024, 11:44:26 AM"
45024662261,detasemen_banten_jaya,18047375641724590,Cair cair cair,https://www.instagram.com/detasemen_banten_jaya,https://instagram.fcgk22-2.fna.fbcdn.net/v/t51.2885-19/447187980_1600417070742136_4415574608527655046_n.jpg,"8/6/2024, 12:19:36 PM"
45024662261,detasemen_banten_jaya,18052557637746434,Geus wayahna ganti bupati . Nu iyeumah sarua na bae produk heubeul . Eta kasus korupsi rsud piraku sebagai wakil teu nyho lamun nyaho kunaon teu di laporkeun,https://www.instagram.com/detasemen_banten_jaya,https://instagram.fcgk22-2.fna.fbcdn.net/v/t51.2885-19/447187980_1600417070742136_4415574608527655046_n.jpg,"8/6/2024, 12:30:52 PM"
67602145361,iwan.kawan001,18037016939068596,"Siapapun pemimpin di KABUPATEN asal jangan ada DINASTI kayak DI PROVINSI BANTEN , KABUPATEN TANGERANG HARUS DEWASA jangan mau di pimpin terus terusan oleh DINASTI POLITIK . Madromli saya pikir bagus memimpin Kabupaten karena tidak menggandeng Kedinastian keluarga .. semoga bisa cari calon wakil bupati yg cocok dengan figur masyarakat Kabupaten Tangerang yaitu Damai dan Rukun👍",https://www.instagram.com/iwan.kawan001,https://instagram.fcgk22-1.fna.fbcdn.net/v/t51.2885-19/454272966_380485398108612_1827725384894082077_n.jpg,"8/6/2024, 3:22:30 PM"
4708242082,zayusriquelme,18422115610070429,Tiap desa dan RT sudah ada anggarannya... Tergantung karang taruna.na dan RT RW setempat nya saja..,https://www.instagram.com/zayusriquelme,https://instagram.fcgk22-2.fna.fbcdn.net/v/t51.2885-19/16908020_267575606996824_2953803409238523904_a.jpg,"8/6/2024, 7:15:07 PM"
2156352741,tamtam_sulis,17972738459673298,@zayusriquelme Iyah terus mantak apah saya minta ke calon bupati,https://www.instagram.com/tamtam_sulis,https://instagram.fcgk22-2.fna.fbcdn.net/v/t51.2885-19/453067496_1034356498353383_7339687692784926178_n.jpg,"8/6/2024, 7:37:15 PM"
4708242082,zayusriquelme,17876974041103812,Ga bakalan di denger minta juga...😢,https://www.instagram.com/zayusriquelme,https://instagram.fcgk22-2.fna.fbcdn.net/v/t51.2885-19/16908020_267575606996824_2953803409238523904_a.jpg,"8/6/2024, 8:09:37 PM"
3252672593,kikilintang26,17922514997947390,"Ada yg bisa menjelaskan, kenapa sampai mad romli tidak didukung sama Zaki ?",https://www.instagram.com/kikilintang26,https://instagram.fcgk22-1.fna.fbcdn.net/v/t51.2885-19/338356461_743441490557412_6218349397842258962_n.jpg,"8/6/2024, 8:26:18 PM"
18052998657,haerulazizi06,18041484814814791,"@kikilintang26 karena ya harus milih adik nya yg jdi wakil nya maesyal mempertahankan Dinasti di kab. Tangerang, yg minim akan kemajuan",https://www.instagram.com/haerulazizi06,https://instagram.fcgk22-1.fna.fbcdn.net/v/t51.2885-19/458486604_945201064314189_7883943347594474028_n.jpg,"8/6/2024, 9:56:09 PM"
2189669340,ekopriianto,17981712101584827,"Mau denger program peningkatan kwalitas transportasi umum di Kabupaten, ada nggk yah ??",https://www.instagram.com/ekopriianto,https://instagram.fcgk22-1.fna.fbcdn.net/v/t51.2885-19/458766559_7893724407421913_8455878289708497605_n.jpg,"8/7/2024, 7:18:34 AM"
60197149707,additonsurya,18009143165556932,@iwan.kawan001 berarti pemilihan Presiden dan wakil ga dewasa yaa yang 58% ???,https://www.instagram.com/additonsurya,https://instagram.fsrg4-1.fna.fbcdn.net/v/t51.2885-19/44884218_345707102882519_2446069589734326272_n.jpg,"8/7/2024, 8:19:21 AM"
56686633875,desynurmayasari5,17872088859088548,"Bismillah pak mad romli menang, amiin yaa rabb🤲🏼 sehat sehat pak sampai waktu kemenangan tiba",https://www.instagram.com/desynurmayasari5,https://instagram.fcgk22-1.fna.fbcdn.net/v/t51.2885-19/314663386_599561095257450_3906552246101594793_n.jpg,"8/7/2024, 10:34:17 AM"
67726847320,rahmatagustrian,17894886711047899,"Mad romli bupati kita,,, mad romli pasti menang👍",https://www.instagram.com/rahmatagustrian,https://instagram.fcgk22-1.fna.fbcdn.net/v/t51.2885-19/449848222_1051138919800013_4405020803937722611_n.jpg,"8/7/2024, 10:52:00 AM"
5656010399,asep_muhajjin00,18004659923395344,@kikilintang26 ya tahta dinasti dari ismet ayah ke zaki anaknya pastinya ke intan adiknya,https://www.instagram.com/asep_muhajjin00,https://instagram.fcgk22-1.fna.fbcdn.net/v/t51.2885-19/172804087_1114095732405905_2025130926648423271_n.jpg,"8/7/2024, 11:44:43 AM"
67053245832,khafidzjr539,17935801703887379,"Tetap semangat pak haji ,terus turun ke masyarakat 🔥",https://www.instagram.com/khafidzjr539,https://instagram.fcgk22-2.fna.fbcdn.net/v/t51.2885-19/454639969_2336787949985471_6155541919282261503_n.jpg,"8/7/2024, 8:17:34 PM"
67589122798,lisalisnawt,18004883633394614,Semoga program2 pak haji terus dikembangkan dan mensejahterahkan rakyat tangerang,https://www.instagram.com/lisalisnawt,https://instagram.fcgk22-2.fna.fbcdn.net/v/t51.2885-19/449844267_792989152985051_9187661576604179752_n.jpg,"8/8/2024, 8:59:35 AM"
56993128691,harum.silviana,18043313131934531,"Calon bupati paling keren se tangerang, senggol dongg",https://www.instagram.com/harum.silviana,https://instagram.fcgk22-2.fna.fbcdn.net/v/t51.2885-19/393146691_1023287225381749_1790367225452902910_n.jpg,"8/8/2024, 9:19:12 AM"
4356219649,yusufandre6085,18041860519789843,Kira kira apa saja pencapaian.@madromlli  selama  menjadi wakil bupati..terus  permasalahan apa saja yg akan dijadikan priogram unggulan kalau tepilih menjadi bupati tangerang ?,https://www.instagram.com/yusufandre6085,https://instagram.fcgk22-2.fna.fbcdn.net/v/t51.2885-19/15802600_1712983005679165_555982730488184832_a.jpg,"8/8/2024, 12:25:56 PM"
9012348318,saitama886hjdhd,18040007029965240,"Bingung mau nyalonin ajah ngebet pngen di pilih, kalau ga nyoblos dibilang golput,, padahal udah kepilih gaadatuh dari dulu prbaikin sistem layana dukcapil msih ajah lama apa sengaja ya di pelihara supaya pungli nya tetep jalan , coba bisa ga bapak beresin hal itu jangan mintanya di pilih doang,, inget pk jadi pmimpin pertanggung jawabannya pasti di tagih nantinya di akhirat sistem layanan dukcapil kok lama banget prosesnya dan ribet giliran ada uangnya ajah baru cepet gatau ya orang kalau buru buru butuh dokumennya gimana",https://www.instagram.com/saitama886hjdhd,https://instagram.fsrg4-1.fna.fbcdn.net/v/t51.2885-19/44884218_345707102882519_2446069589734326272_n.jpg,"8/10/2024, 6:14:15 AM"
4140542263,ariefirawan_88,18011937323316546,"Mantan Wakil bupati  bisa bantu urus ulang cetak ktp saya san istri engga, krn setaunsaya urusnya ribet sampe ke pemda, kalau anda bisa bantu dengan proses cepat brti anda perhatian sama warganya",https://www.instagram.com/ariefirawan_88,https://instagram.fcgk22-2.fna.fbcdn.net/v/t51.2885-19/341940296_555282363380744_7903602594722705234_n.jpg,"8/11/2024, 7:59:29 AM"
44412814226,andryleadies,17915962907971553,Satu komando untuk memenangkan bpk mad Romli untuk Tangerang satu,https://www.instagram.com/andryleadies,https://instagram.fcgk22-2.fna.fbcdn.net/v/t51.2885-19/314320926_1734120123625264_7332382463524282195_n.jpg,"8/11/2024, 11:17:17 PM"
67980644291,herminsarie,18057955321660052,Saya mah pilih yang pasti2 aja.. pasti jujur Dan amanah seperti pak haji,https://www.instagram.com/herminsarie,https://instagram.fcgk22-1.fna.fbcdn.net/v/t51.2885-19/451353946_492297106626834_5915406325197464548_n.jpg,"8/12/2024, 9:25:27 AM"
62479853985,zein.cindy,17863001700196059,Pak haji ombi bupati kita semua🔥,https://www.instagram.com/zein.cindy,https://instagram.fcgk22-1.fna.fbcdn.net/v/t51.2885-19/392739812_351955720672314_3517625918212053094_n.jpg,"8/12/2024, 12:00:20 PM"
62136198332,sinta.nita__,18039656833985902,Asli tangerang tentu saya pilih di tps dong🫰🏼👍🏻,https://www.instagram.com/sinta.nita__,https://instagram.fcgk22-1.fna.fbcdn.net/v/t51.2885-19/392796326_1419695222222479_6763844973472559214_n.jpg,"8/12/2024, 12:25:09 PM"
65779273601,noer_agris,18045373588911067,Justru bapak inspirasi saya untuk bisa terus berkontribusi di masyarakat🔥,https://www.instagram.com/noer_agris,https://instagram.fcgk22-2.fna.fbcdn.net/v/t51.2885-19/456876294_737841045112439_8409751290673375416_n.jpg,"8/13/2024, 8:26:38 AM"
62535784426,indahdwiseptiana_,18021023453585988,Dukung terus putera aseli tangerang🔥,https://www.instagram.com/indahdwiseptiana_,https://instagram.fcgk22-1.fna.fbcdn.net/v/t51.2885-19/392751716_338774722039626_6571989558321518236_n.jpg,"8/13/2024, 8:31:04 AM"
67941756172,desinuraini99,18426829243067092,"Saya percaya tangerang akan semakin maju bersiar dan sejahtera ditangan bapak, bismillah tekad baik dilancarkan🙏🏻",https://www.instagram.com/desinuraini99,https://instagram.fcgk22-2.fna.fbcdn.net/v/t51.2885-19/450580893_849362550421321_2833630388085317777_n.jpg,"8/13/2024, 10:37:55 AM"
62130999072,poppy.rahmm__,17855952972236671,Calon bupati yang gemar mendengarkan masukan Dari warga❤️ lanjutkan pak akrena itu yang dibutuhkan,https://www.instagram.com/poppy.rahmm__,https://instagram.fcgk22-2.fna.fbcdn.net/v/t51.2885-19/392954734_1348377295769374_3072597111552562292_n.jpg,"8/14/2024, 9:06:30 AM"
62131782853,rizaldi_tresno,17884803201094711,Calon bupati yang banyak menginspirasi orang🔥,https://www.instagram.com/rizaldi_tresno,https://instagram.fcgk22-2.fna.fbcdn.net/v/t51.2885-19/393063735_349696240759312_1472953807513430987_n.jpg,"8/14/2024, 9:17:28 AM"
67767768162,agusrianto77_,18061622494625074,Pak mad romli bupati tangerang menang 1 putran,https://www.instagram.com/agusrianto77_,https://instagram.fcgk22-1.fna.fbcdn.net/v/t51.2885-19/449853690_1454922508513182_3320220262655182307_n.jpg,"8/14/2024, 12:36:14 PM"
67769449833,berlinadilaa,18008187905558711,Bismillah menang pak haji saya dukung pak haji sampai jadi bupati,https://www.instagram.com/berlinadilaa,https://instagram.fcgk22-1.fna.fbcdn.net/v/t51.2885-19/450563850_473583522072317_4828062295378377230_n.jpg,"8/15/2024, 10:37:58 AM"
67934446805,kerlianaaa,18056455279736684,Pilih yang pasti ya pasti mad romli🔥,https://www.instagram.com/kerlianaaa,https://instagram.fcgk22-1.fna.fbcdn.net/v/t51.2885-19/450693309_385362664121046_3933333807141358375_n.jpg,"8/15/2024, 10:57:29 AM"
62356011229,derirzkywn,18101995594426468,Yang kayak Gini ga didukung warga ya rugi lah,https://www.instagram.com/derirzkywn,https://instagram.fcgk22-2.fna.fbcdn.net/v/t51.2885-19/393306328_791587316101286_2788994434314630430_n.jpg,"8/15/2024, 1:09:10 PM"
45323940896,photographermarhaen,18034679512919646,@detasemen_banten_jaya hmmmm kan bapaknya koruptor blm tentu anaknya koruptor,https://www.instagram.com/photographermarhaen,https://instagram.fcgk22-2.fna.fbcdn.net/v/t51.2885-19/155276209_155489879650336_1468275843253443666_n.jpg,"8/16/2024, 1:30:55 PM"
45024662261,detasemen_banten_jaya,18133527250358236,"@photographermarhaen koruptor ga mengenal siapa lu, siapa gue , ga kenal kaya ga kenal miskin . 

Suap org juga sama perilakunya dengan korupto",https://www.instagram.com/detasemen_banten_jaya,https://instagram.fcgk22-2.fna.fbcdn.net/v/t51.2885-19/447187980_1600417070742136_4415574608527655046_n.jpg,"8/16/2024, 1:33:21 PM"
1637340437,morenopradikto,18035066677915706,Tangerang semakin sejahtera bersama paa madromli🔥🔥🔥,https://www.instagram.com/morenopradikto,https://instagram.fcgk22-1.fna.fbcdn.net/v/t51.2885-19/456189245_839775768356016_2090824279048558787_n.jpg,"8/19/2024, 10:48:51 AM"
62216666898,septisafitri_1,18017559815395954,Sering2 pak ketemu warga❤️,https://www.instagram.com/septisafitri_1,https://instagram.fcgk22-2.fna.fbcdn.net/v/t51.2885-19/395349307_1752261578538767_9139790749911449721_n.jpg,"8/20/2024, 10:25:20 AM"
62659100624,andryputraalix,18003719396443180,Bismillah semoga bisa terus jadi pempimpin amanah yang mendengarkan rakyat aminn,https://www.instagram.com/andryputraalix,https://instagram.fcgk22-1.fna.fbcdn.net/v/t51.2885-19/395277114_647409024238971_5382876946772735545_n.jpg,"8/21/2024, 9:02:33 AM"
19624192526,furqonbudi,18273687526209430,pak madromli calon bupati kebanggaaan🔥🔥🔥,https://www.instagram.com/furqonbudi,https://instagram.fcgk22-1.fna.fbcdn.net/v/t51.2885-19/456306440_316966534771917_4966384575769894821_n.jpg,"8/22/2024, 11:21:47 AM"
18814048054,hengkiranto,17861858679214002,Siap meramaikan bersama pasukan pak madromli,https://www.instagram.com/hengkiranto,https://instagram.fcgk22-1.fna.fbcdn.net/v/t51.2885-19/458753749_433815423024150_1995002898097134985_n.jpg,"8/26/2024, 11:06:35 AM"
67770669194,bangargae,17876197752143548,Lancar terus sampe hari h,https://www.instagram.com/bangargae,https://instagram.fcgk22-2.fna.fbcdn.net/v/t51.2885-19/451763741_423118987383827_3744411278075795414_n.jpg,"9/2/2024, 9:24:59 AM"
4163370309,yudistirafebriansyah27,18128578783370593,Hj mad romli jadi bupati🔥🔥🔥🔥,https://www.instagram.com/yudistirafebriansyah27,https://instagram.fcgk22-2.fna.fbcdn.net/v/t51.2885-19/456255482_3771422513125484_4963619810255692631_n.jpg,"9/3/2024, 12:37:58 PM"
67617481903,kikiyaomi,18034841147153517,😍😍 terbaekk emg pak haji ini,https://www.instagram.com/kikiyaomi,https://instagram.fcgk22-1.fna.fbcdn.net/v/t51.2885-19/452640228_1197299461553537_5436604316428032981_n.jpg,"9/6/2024, 11:36:42 AM"
35391360452,agusjanardi,17922841694868185,Mantapp semua warga dukung mad romli,https://www.instagram.com/agusjanardi,https://instagram.fcgk22-2.fna.fbcdn.net/v/t51.2885-19/456242343_1742664783161492_9099636521332303108_n.jpg,"9/6/2024, 11:42:01 AM"
25006356923,ahmd_fznnn,18061522921633287,Siap ikut mengawal pak haji ombi sampe jadi nomor 1 tangerang,https://www.instagram.com/ahmd_fznnn,https://instagram.fcgk22-1.fna.fbcdn.net/v/t51.2885-19/458151193_520357490351655_8168199674524362506_n.jpg,"9/12/2024, 9:00:18 AM"