User Id,User Name,Comment Id,Comment Text,Profile URL,Avatar URL,Publish Date
4374743160,padlialmasajid,17973178268765995,Rekomnya boleh di ambil kembali oleh orang dalam. Tapi kader partai mya solid dukung sang ketua DPD. Karena H. Madromli itu Golkar dan Golkar itu H. Madromli.... #PD Golkar Desa Cangkudu Balaraja,https://www.instagram.com/padlialmasajid,https://instagram.fcgk22-1.fna.fbcdn.net/v/t51.2885-19/244464472_669072180740718_9045996262703927943_n.jpg,"8/29/2024, 5:47:44 PM"
18052998657,haerulazizi06,18457201900007308,Semangat walaupun tidak dukung rumah sendiri tapi masyarakat selalu ada bersama H. Madromli,https://www.instagram.com/haerulazizi06,https://instagram.fcgk22-1.fna.fbcdn.net/v/t51.2885-19/458486604_945201064314189_7883943347594474028_n.jpg,"8/29/2024, 6:18:26 PM"
63266050145,sobri8813,17909073575992745,"Mantap, madromli menang menang menang!!",https://www.instagram.com/sobri8813,https://instagram.fcgk22-1.fna.fbcdn.net/v/t51.2885-19/412579575_1781084462407531_1900557412409606123_n.jpg,"8/29/2024, 6:48:53 PM"
61777389945,ridwan_arab91,18074123107546276,Saya dan keluarga siap mendukung @h.madromli,https://www.instagram.com/ridwan_arab91,https://instagram.fcgk22-1.fna.fbcdn.net/v/t51.2885-19/425578920_702853705372349_3620332753029127406_n.jpg,"8/29/2024, 7:21:57 PM"
64024057580,kondearmstrong,17930972015798694,Rekom gpp ke Rudi maesal tapi kader Golkar solid dukung H ombi. Ibarat kata Rudi cuma bawa serangka tapi goloknya ada di haji ombi...🔥🔥🔥🔥,https://www.instagram.com/kondearmstrong,https://instagram.fcgk22-2.fna.fbcdn.net/v/t51.2885-19/416525921_743258447693470_6495917321484937689_n.jpg,"8/29/2024, 7:59:57 PM"
10916589888,nnrawbi,18452767897019697,"semangat terus pak haji, setia dukunggg 👏",https://www.instagram.com/nnrawbi,https://instagram.fcgk22-2.fna.fbcdn.net/v/t51.2885-19/51224322_347626905832052_828087557437784064_n.jpg,"8/29/2024, 8:31:23 PM"
50283081726,robbienoize,18008799698354164,"Here we go, come on 🔥🔥🔥",https://www.instagram.com/robbienoize,https://instagram.fcgk22-2.fna.fbcdn.net/v/t51.2885-19/446688508_1640446496792536_530203686168448950_n.jpg,"8/29/2024, 9:33:54 PM"
54821820690,juli_adani07,18029586347468211,semangat terus pak h.madromli 🔥,https://www.instagram.com/juli_adani07,https://instagram.fcgk22-2.fna.fbcdn.net/v/t51.2885-19/460325814_943679241131944_170278269732871806_n.jpg,"8/29/2024, 10:00:24 PM"
2084081606,anggun_sumantri,17942109569761270,"Pak semangat, apapun ituuu jangan menyerah ttaplah bersinar 🔥🔥 #akuuuuupadamuuuuu pak",https://www.instagram.com/anggun_sumantri,https://instagram.fcgk22-1.fna.fbcdn.net/v/t51.2885-19/320491569_1397240981083757_4045270298208088302_n.jpg,"8/30/2024, 5:56:00 AM"
21873191369,bagassaleh_drb,18038800943046415,"pak haji tetap dijalur yang benar & jujur, kalau yang samping sih ada yang rampas hak milik orang😶",https://www.instagram.com/bagassaleh_drb,https://instagram.fcgk22-2.fna.fbcdn.net/v/t51.2885-19/82186842_648353675704640_2035653067663212544_n.jpg,"8/30/2024, 7:33:01 AM"
5660524477,mahmoed.bey,18033669755151660,"ini sama kayak kasus airin dan mantan bupati dairi(SUMUT) ditinggalkan GOLKAR.tetapi kasus airin tdk sama,karna Kekuatan airin di pertimbangkan di Banten. ditakutkan kader pecah belah.#salamdemokrasi# Ketumnya lg candu kecubung jd rada linglung.",https://www.instagram.com/mahmoed.bey,https://instagram.fcgk22-1.fna.fbcdn.net/v/t51.2885-19/398454415_318032267595139_8301130107445496567_n.jpg,"8/30/2024, 10:02:08 AM"
67770669194,bangargae,18038346062028849,Semangat pak... Golkar tetap rumah bagi bapak.. skrg ibarat kata lagi ada maling yang ngacak2 rumah.. ayo pak semoga kuat utk memerjuangkan rumah kita💛💛💛,https://www.instagram.com/bangargae,https://instagram.fcgk22-2.fna.fbcdn.net/v/t51.2885-19/451763741_423118987383827_3744411278075795414_n.jpg,"8/30/2024, 10:02:53 AM"
4163370309,yudistirafebriansyah27,18097494889444344,Berjuang lebih keras untuk menang satu putaraan🔥🔥,https://www.instagram.com/yudistirafebriansyah27,https://instagram.fcgk22-2.fna.fbcdn.net/v/t51.2885-19/456255482_3771422513125484_4963619810255692631_n.jpg,"8/30/2024, 11:53:30 AM"
67934446805,kerlianaaa,18063509287719334,Berjuang terus sampai menang🔥🔥,https://www.instagram.com/kerlianaaa,https://instagram.fcgk22-1.fna.fbcdn.net/v/t51.2885-19/450693309_385362664121046_3933333807141358375_n.jpg,"8/30/2024, 12:12:12 PM"
5750466967,jaelani7505,18052756675671568,"Kami keoengurusan PK , PD/PL kec Curug serta wrg kec Curug siap mendukung dan mencoblos H.MAD ROMLI dan IRVANSYAH ASMAT",https://www.instagram.com/jaelani7505,https://instagram.fcgk22-2.fna.fbcdn.net/v/t51.2885-19/368122143_824107709201159_1075320972556520873_n.jpg,"8/30/2024, 4:38:21 PM"
7321751643,doyokaef,17861761512163260,Berjuang terus harus menang 🔥🔥🔥🔥,https://www.instagram.com/doyokaef,https://instagram.fcgk22-1.fna.fbcdn.net/v/t51.2885-19/272860796_120168710532540_7566576598435406052_n.jpg,"8/30/2024, 5:54:33 PM"
59915642705,alex.bule41,18032034944510664,"Insyaallah bertanda baik buat kita pendukungnya, Di dZolimin partai' malah membuat kita kuat, gaskeun ...",https://www.instagram.com/alex.bule41,https://instagram.fcgk22-1.fna.fbcdn.net/v/t51.2885-19/354031096_1405770816884898_1280549862730730197_n.jpg,"8/30/2024, 6:09:30 PM"
51477988269,ali262asgar,18042844231820503,"Diakar rumput dan lapisan paling bawah tetap mendukung H.Madromlih,insyaAllah semua usaha,ikhtiar dan perjuangan akan mendapatkan hasil yg terbaik H.Mad Romli utk Kab Tng .",https://www.instagram.com/ali262asgar,https://instagram.fcgk22-1.fna.fbcdn.net/v/t51.2885-19/312710771_661656978663881_8404262937230836011_n.jpg,"8/30/2024, 7:29:42 PM"
29669775423,fhm_hff11,18056256763624207,"Tangerang punya orang Tangerang,bukan punya pendatang...#moal_oyag @h.madromli",https://www.instagram.com/fhm_hff11,https://instagram.fcgk22-2.fna.fbcdn.net/v/t51.2885-19/265511341_649905419483716_3641525780926950207_n.jpg,"8/30/2024, 11:56:11 PM"
6005385651,ferdiyantoewonk,17895356336980558,kami selalu bersamamu pak h.ombi ....,https://www.instagram.com/ferdiyantoewonk,https://instagram.fcgk22-1.fna.fbcdn.net/v/t51.2885-19/140571568_420204109291092_3664332817897044081_n.jpg,"8/31/2024, 2:18:16 PM"
66984833374,biskuitanyarkongguan,17931939620806835,sya selaku pengurus PD desa Patrasana siap mengawal pak haji madromli dan pak Haji irvansyah Asmat sebagai bupati dan wakil Bupati kabupaten Tangerang 💪💪,https://www.instagram.com/biskuitanyarkongguan,https://instagram.fcgk22-2.fna.fbcdn.net/v/t51.2885-19/449300733_513036057944171_7204685933813311065_n.jpg,"9/1/2024, 7:37:48 AM"
60566670675,caritahudong,18031002179248698,"Sebagai Ketua DPP Partai Golkar Kabupaten Tangerang, sudah semestinya Bpk. Mad Romli dan kader kader partai Golkar Kabupaten Tangerang Mendukung Bpk. Moh. Maesyal Rasyid dan Ibu Intan Nurul Hikmah. 
karena  B1 KWK Partai Golkar mutlak diberikan kepada Bpk. Moh. Maesyal Rasyid dan Ibu Intan Nurul Hikmah oleh Ketua Umum Partai Golkar.",https://www.instagram.com/caritahudong,https://instagram.fcgk22-2.fna.fbcdn.net/v/t51.2885-19/457411623_496146166358878_5763809914324693339_n.jpg,"9/1/2024, 10:31:49 AM"
18814048054,hengkiranto,17881412766052598,Tentunya berjuang demi kemenangan,https://www.instagram.com/hengkiranto,https://instagram.fcgk22-1.fna.fbcdn.net/v/t51.2885-19/458753749_433815423024150_1995002898097134985_n.jpg,"9/2/2024, 11:07:52 AM"
1637340437,morenopradikto,17881052145056715,Semangat pak saya tetep ada dibarisan bapak,https://www.instagram.com/morenopradikto,https://instagram.fcgk22-1.fna.fbcdn.net/v/t51.2885-19/456189245_839775768356016_2090824279048558787_n.jpg,"9/2/2024, 11:14:52 AM"
19624192526,furqonbudi,18067479175588269,Lancar2 pak haji🙏🏻,https://www.instagram.com/furqonbudi,https://instagram.fcgk22-1.fna.fbcdn.net/v/t51.2885-19/456306440_316966534771917_4966384575769894821_n.jpg,"9/2/2024, 11:19:12 AM"
62131782853,rizaldi_tresno,18053362207809740,Tetap semangat pak banyak warga yang mendukung,https://www.instagram.com/rizaldi_tresno,https://instagram.fcgk22-2.fna.fbcdn.net/v/t51.2885-19/393063735_349696240759312_1472953807513430987_n.jpg,"9/3/2024, 8:32:34 AM"
62356011229,derirzkywn,18068893060587722,Masyaallah inspirasi sekali😢,https://www.instagram.com/derirzkywn,https://instagram.fcgk22-2.fna.fbcdn.net/v/t51.2885-19/393306328_791587316101286_2788994434314630430_n.jpg,"9/3/2024, 8:46:59 AM"
62216666898,septisafitri_1,18023809892124163,Semangat pak.. walaupun dizolimi Dari manapun semoga tetap tegar😢,https://www.instagram.com/septisafitri_1,https://instagram.fcgk22-2.fna.fbcdn.net/v/t51.2885-19/395349307_1752261578538767_9139790749911449721_n.jpg,"9/4/2024, 10:28:52 AM"
66535291578,ramdandani41,17963869637664905,Semoga sukses sampai Tutik darah penghabisan sy Ramdan dari desa marga Mulya siap berjuang untuk bpk,https://www.instagram.com/ramdandani41,https://instagram.fcgk22-1.fna.fbcdn.net/v/t51.2885-19/441436645_804102977944023_4100452034529156489_n.jpg,"9/4/2024, 12:42:59 PM"
2024088198,yusufwjyy,18042001699974655,Semangat perjuangan untuk kemenangan MAVAN🔥🔥🔥🔥,https://www.instagram.com/yusufwjyy,https://instagram.fcgk22-2.fna.fbcdn.net/v/t51.2885-19/456141558_1192029365175758_4917028844964153806_n.jpg,"9/4/2024, 12:47:29 PM"
35391360452,agusjanardi,17862951978216141,Semangat pak haji sy tetep dukung haji ombi & irvansyah,https://www.instagram.com/agusjanardi,https://instagram.fcgk22-2.fna.fbcdn.net/v/t51.2885-19/456242343_1742664783161492_9099636521332303108_n.jpg,"9/5/2024, 9:59:29 AM"
67617481903,kikiyaomi,18082815265455139,Semangat pak haji kita selalu dukung pak haji ombi,https://www.instagram.com/kikiyaomi,https://instagram.fcgk22-1.fna.fbcdn.net/v/t51.2885-19/452640228_1197299461553537_5436604316428032981_n.jpg,"9/5/2024, 10:03:02 AM"
67769449833,berlinadilaa,18276164881242527,Semoga dilancarkan pak haji bismillah menang,https://www.instagram.com/berlinadilaa,https://instagram.fcgk22-1.fna.fbcdn.net/v/t51.2885-19/450563850_473583522072317_4828062295378377230_n.jpg,"9/6/2024, 11:26:00 AM"
62136198332,sinta.nita__,17903542506022262,Semangaaat paaa!! Bismillah menang satu putaran dan dilancarkan semuanyaa❤️,https://www.instagram.com/sinta.nita__,https://instagram.fcgk22-1.fna.fbcdn.net/v/t51.2885-19/392796326_1419695222222479_6763844973472559214_n.jpg,"9/6/2024, 11:43:45 AM"
62535784426,indahdwiseptiana_,18034207631180198,Yaallah semangat terus ya pak haji😢 semoga selalu dalam lindungan-Nya😢,https://www.instagram.com/indahdwiseptiana_,https://instagram.fcgk22-1.fna.fbcdn.net/v/t51.2885-19/392751716_338774722039626_6571989558321518236_n.jpg,"9/9/2024, 8:53:12 AM"
62659100624,andryputraalix,18016503647278549,Walaupun digoyang sana sini beliau tetap pny tekad melayani masyarakat dengan baik masyaallah,https://www.instagram.com/andryputraalix,https://instagram.fcgk22-1.fna.fbcdn.net/v/t51.2885-19/395277114_647409024238971_5382876946772735545_n.jpg,"9/9/2024, 9:09:55 AM"
67587739017,wulandarisrrr,18050212162891996,Bismillah pak smg hasil baik utk kemenangan bpk,https://www.instagram.com/wulandarisrrr,https://instagram.fcgk22-2.fna.fbcdn.net/v/t51.2885-19/449839305_856721302973434_2018225328723200248_n.jpg,"9/9/2024, 11:11:30 AM"
48353757193,hestirahmawati305,18364895962129396,"Semangat terus pak,semangat pak",https://www.instagram.com/hestirahmawati305,https://instagram.fcgk22-1.fna.fbcdn.net/v/t51.2885-19/358422665_272683385347716_953193425015960501_n.jpg,"9/10/2024, 7:34:25 AM"
25006356923,ahmd_fznnn,18014670254315935,Semoga seluruh perjuangan membuahkan hasil amin,https://www.instagram.com/ahmd_fznnn,https://instagram.fcgk22-1.fna.fbcdn.net/v/t51.2885-19/458151193_520357490351655_8168199674524362506_n.jpg,"9/10/2024, 10:11:18 AM"
5360013563,rehancahyadnt,18024261497458786,Terima kasih pak haji sudah berjuang bersama rakyat,https://www.instagram.com/rehancahyadnt,https://instagram.fcgk22-2.fna.fbcdn.net/v/t51.2885-19/457802370_504375822350446_1651589013410973069_n.jpg,"9/12/2024, 9:05:00 AM"
67767768162,agusrianto77_,17940101579891075,Smgt sy hadir tuk mendkung bpk🙏,https://www.instagram.com/agusrianto77_,https://instagram.fcgk22-1.fna.fbcdn.net/v/t51.2885-19/449853690_1454922508513182_3320220262655182307_n.jpg,"9/12/2024, 11:31:44 AM"